{
  "$schema": "./schemas/cv.schema.json",
  "experience": [
    {
      "id": "studio-b",
      "role": "Architectural Designer",
      "company": "Studio B Architects",
      "location": "City, Country",
      "start": "2023-03",
      "end": "present",
      "descriptor": "Design and delivery of a 4-storey mixed-use building from concept to construction documents.",
      "bullets": [
        {
          "id": "roof-facade-details",
          "text": "Developed the roof and facade details, coordinating drainage and parapet build-ups with consultants.",
          "figure": {
            "figure": "building-model",
            "parts": ["roof", "facade"]
          },
          "partIds": ["roof", "facade"],
          "figures": ["roof-parapet-detail", "construction-details"],
          "children": [
            {
              "id": "roof-parapet",
              "text": "Roof parapet and drainage build-up.",
              "figure": {
                "figure": "roof-parapet-detail"
              },
              "views": [
                {
                  "figure": "building-model",
                  "part": "roof",
                  "azimuth": 20,
                  "elevation": 40
                },
                {
                  "figure": "construction-details",
                  "image": 0
                }
              ]
            },
            {
              "id": "panel-joints",
              "text": "Rainscreen panel joints and fixings.",
              "figure": {
                "figure": "construction-details",
                "image": 1
              },
              "views": [
                {
                  "figure": "building-model",
                  "part": "facade",
                  "azimuth": -30
                },
                {
                  "figure": "construction-details",
                  "image": 1
                }
              ]
            }
          ]
        },
        {
          "id": "facade-scripts",
          "text": "Wrote Dynamo scripts that place and number facade panels, cutting a week of manual work per issue.",
          "figure": {
            "figure": "facade-panel-numbering"
          },
          "partIds": ["facade"],
          "figures": ["facade-panel-numbering", "facade-sequence", "panel-morph"],
          "children": [
            {
              "id": "panel-numbering",
              "text": "Panel numbering by elevation, written back to the model.",
              "figure": {
                "figure": "panel-numbering-code",
                "lines": [43, 46]
              },
              "views": [
                {
                  "figure": "panel-numbering-code",
                  "lines": [43, 46]
                },
                {
                  "figure": "facade-sequence",
                  "time": 1.5,
                  "until": 4.75
                },
                {
                  "figure": "panel-morph",
                  "marker": "numbering"
                }
              ]
            },
            {
              "id": "schedule-export",
              "text": "Automatic panel schedule export for the fabricator.",
              "figure": {
                "figure": "panel-morph",
                "marker": "schedule"
              },
              "views": [
                {
                  "figure": "facade-panel-numbering",
                  "region": [50, 20, 50, 60]
                },
                {
                  "figure": "facade-sequence",
                  "time": 4.75
                },
                {
                  "figure": "panel-morph",
                  "marker": "schedule"
                }
              ]
            },
            {
              "id": "bay-preview",
              "text": "Bay-by-bay placement preview.",
              "figure": {
                "figure": "facade-sequence",
                "time": 1.5,
                "until": 4.75
              },
              "views": []
            }
          ]
        },
        {
          "id": "structure-model",
          "text": "Modelled the structural grid and slab edges, keeping the Revit model in sync with the engineer's analysis model.",
          "figure": {
            "figure": "building-model",
            "parts": ["floors", "core"]
          },
          "partIds": ["floors", "core"],
          "figures": ["section-a-a", "level-slab-sync"],
          "children": [
            {
              "id": "core-section",
              "text": "Section through the core and slabs.",
              "figure": {
                "figure": "building-model",
                "parts": ["floors"],
                "drawing": "section-a-a"
              },
              "views": [
                {
                  "figure": "building-model",
                  "part": "floors",
                  "drawing": "section-a-a"
                },
                {
                  "figure": "section-a-a",
                  "region": [35, 0, 30, 100]
                }
              ]
            },
            {
              "id": "level-02-plan",
              "text": "Level 02 plan coordination.",
              "figure": {
                "figure": "plan-level-02"
              },
              "views": [
                {
                  "figure": "building-model",
                  "part": "floors",
                  "drawing": "plan-level-02"
                },
                {
                  "figure": "plan-level-02"
                }
              ]
            }
          ]
        },
        {
          "text": "Led weekly BIM coordination meetings and clash detection reviews.",
          "figure": {
            "figure": "massing-diagram"
          }
        }
      ]
    },
    {
      "id": "office-a",
      "role": "Architectural Assistant",
      "company": "Office A",
      "location": "City, Country",
      "start": "2021-06",
      "end": "2023-02",
      "descriptor": "Residential and small commercial projects, with a focus on technical documentation (see {fig:construction-details}).",
      "bullets": [
        {
          "text": "Produced foundation and ground-floor setting-out drawings for planning and tender packages, including the core section ({fig:section-a-a}).",
          "figure": {
            "figure": "building-model",
            "parts": ["foundation"]
          },
          "partIds": ["foundation"]
        },
        {
          "text": "Built a Dynamo graph that generates room data sheets from the model.",
          "figure": {
            "figure": "level-slab-sync"
          }
        }
      ]
    }
  ],
  "education": [
    {
      "id": "march",
      "degree": "Master of Architecture",
      "school": "University Placeholder",
      "location": "City, Country",
      "start": "2019-09",
      "end": "2021-06",
      "notes": "Thesis on rule-based facade generation."
    },
    {
      "id": "ba",
      "degree": "BA (Hons) Architecture",
      "school": "University Placeholder",
      "location": "City, Country",
      "start": "2016-09",
      "end": "2019-06"
    }
  ],
  "skills": [
    {
      "group": "BIM",
      "items": ["Revit", "Navisworks", "IFC workflows"]
    },
    {
      "group": "Computational",
      "items": ["Dynamo", "Python", "Grasshopper"]
    },
    {
      "group": "Design & Visualisation",
      "items": ["AutoCAD", "Rhino", "Enscape", "Adobe Creative Suite"]
    }
  ],
  "certifications": [
    {
      "name": "Autodesk Certified Professional: Revit",
      "issuer": "Autodesk",
      "year": 2024
    }
  ],
  "languages": [
    {
      "name": "English",
      "level": "Fluent"
    },
    {
      "name": "Second Language",
      "level": "Native"
    }
  ]
}
